<?xml version="1.0" encoding="UTF-8"?>
<students xmlns:xsi="http://www.w3.org/2001/XMLSchema-instance" xsi:noNamespaceSchemaLocation="file:///C:/Users/%e9%bb%84%e9%94%a6%e9%94%a6/Desktop/xmlwenjian/schema.xsd">
	<student StuId="1">
		<name>张三</name>
		<gender>男</gender>
		<age>20</age>
	</student>
	<student StuId="2">
		<name>李四</name>
		<gender>女</gender>
		<age>19</age>
	</student>
	<student StuId="3">
		<name>王二</name>
		<gender>男</gender>
		<age>21</age>
	</student>
</students>
